{
  "schema":"synergy.plugin.v1",
  "id":"capability.calendar",
  "name":"Universal Calendar Capability Pack",
  "version":"1.0.0",
  "kind":"business",
  "provider":"connector.gateway",
  "capabilities":[
    {"name":"calendar.read","risk":"Medium","requires_approval":false,"mapped_core_capabilities":["NetworkAccess"]},
    {"name":"calendar.event.create","risk":"High","requires_approval":true,"mapped_core_capabilities":["NetworkAccess"]},
    {"name":"calendar.event.update","risk":"High","requires_approval":true,"mapped_core_capabilities":["NetworkAccess"]}
  ],
  "endpoints":[{"transport":"openapi_gateway","address":"connector.gateway/openapi.call"}],
  "tags":["calendar","schedule","openapi"],
  "requires":["connector.gateway"],
  "enabled_by_default":false
}
